시도,시군구,건강증진센터구분,건강증진센터명,소재지도로명주소,건강증진업무내용,운영기관전화번호,위도,경도
울산광역시,동구,건강증진,울산광역시 동구보건소 건강증진센터,울산광역시 동구 봉수로 155,장애인 전용 건강증진 프로그램 운영,052-209-4058,35.5050697141,129.4164300357
울산광역시,동구,정신보건,울산광역시동구정신건강증진센터,울산광역시 동구 봉수로 155,"만성정신질환자관리, 지역주민 정신건강증진, 아동청소년정신보건, 자살예방사업",052-209-1040,35.5050697141,129.4164300357
울산광역시,남구,건강증진,무거건강생활지원센터,울산광역시 남구 대학로 147번길 41-26,건강생활습관 형성지원 및 만성질환 예방관리,052-226-2345,35.55124599,129.2596398
울산광역시,북구,건강증진,울산광역시 북구보건소 건강증진센터,"울산광역시 북구 산업로 1018, 2층건강관리센터",만성질환 예방 및 관리,052-241-8168,35.5835548619,129.3607258
부산광역시,사하구,건강증진,통합건강증진센터,"부산광역시 사하구 하신중앙로185(신평동, 사하구제2청사)","대사증후군 클리닉, 영양, 금연클리닉, 모바일헬스케어",051-220-5781,35.09496298,128.9615461
부산광역시,사하구,정신보건,사하구정신건강복지센터,"부산광역시 사하구 장림번영로 41, 한국메디칼빌딩 5층(장림동)","정신건강증진사업, 중증정신질환자관리사업, 아동청소년정신건강증진사업, 자살예방사업",051-263-8891,35.08083406,128.9699332
전라남도,함평군,건강증진,함평군통합건강관리센터,전라남도 함평군 함평읍 중앙길 54-8,"신체활동, 영양, 비만 등 건강상담",061-320-2451,35.06189599,126.5242477
충청남도,당진시,건강증진,당진시보건소 건강증진센터,충청남도 당진시 서부로 56,"건강상담, 금연상담, 운동체험, 건강체험",041-360-6004,36.88735969,126.6304725
경기도,여주시,정신보건,여주시정신건강복지센터,경기도 여주시 여흥로160번길 14(상동),정신건강증진 및 자살예방사업,031-886-3435,37.29461028,127.640392
경기도,안산시,건강증진,안산시 고혈압당뇨병 등록교육센터,경기도 안산시 상록구 차돌배기로1길 5(3층일부),"고혈압 당뇨병환자 등록 관리, 기본검사 및 상담 교육(기본,심화,체험,운동), 리콜리마인드서비스, 건강행태개선 인센티브 지원, 치료비 및 등록비 지원 등",031-416-9088,37.300265,126.84504
경기도,화성시,건강증진,웰빙건강클리닉센터(서신),경기도 화성시 서신면 궁평항로 1702,생애주기별_신체활동프로그램_제공,031-5189-6482,37.1665869768,126.7087356267
경기도,화성시,건강증진,웰빙건강클리닉센터(서신),경기도 화성시 서신면 궁평항로 1702,생애주기별_신체활동프로그램_제공,031-5189-6482,37.1665869768,126.7087356267
경기도,안산시,정신보건,안산시자살예방센터,경기도 안산시 상록구 차돌배기로1길 5,자살예방업무,031-418-0123,37.300265,126.84504
경기도,안산시,정신보건,정신건강복지센터,"경기도 안산시 단원구 화랑로 387, 구 단원보건소 1층",정신질환자 등록관리 및 정신건강증진 사업,031-411-7573,37.3225569017,126.8327135158
경기도,안산시,정신보건,중독관리통합지원센터,"경기도 안산시 단원구 화랑로 387, 구 단원보건소 2층",중독자 등록관리 및 중독예방사업,031-411-8445,37.3225569017,126.8327135158
서울특별시,금천구,정신보건,금천구정신건강복지센터,서울특별시 금천구 시흥대로 123길 11,"중증정신질환자관리,아동청소년정신건강사업,알코올중독관리사업,자살위기대응사업",02-3281-9314,37.47021905,126.897019
부산광역시,서구,정신보건,부산서구정신건강복지센터,부산광역시 서구 부용로30,"중증정신질환자관리사업, 정신건강증진사업, 아동청소년정신보건사업, 자살예방사업",051-246-1981,35.10743623,129.018061
제주특별자치도,제주시,정신보건,제주시정신건강복지센터,제주특별자치도 제주시 연삼로 264,고위험군 등록 및 사례관리. 재활프로그램 운영. 자살유가족 서비스. 상담 및 교육 홍보 등,064-728-4074,33.49159994,126.520276
제주특별자치도,제주시,정신보건,제주중독관리통합지원센터,제주특별자치도 제주시 서사로 184,중독조기발견 및 개입서비스. 중독질환 관리.  중독폐혜 예방교육 및 홍보 등,064-759-0911,33.49593437,126.5194874
전라남도,무안군,건강증진,남악 건강생활지원센터,전라남도 무안군 삼향읍 남악3로 40(2층),"건강생활실천, 만성질환관리, 여성과 어린이건강관리, 지역거버넌스 구축",061-450-5001,34.80941832,126.4610002263
전라남도,해남군,건강증진,해남건강누리센터,전라남도 해남군 해남읍 해남로 46,"운동·영양상담, 금연상담, 체력단련",061-531-3786,34.57046123,126.6120439
서울특별시,은평구,정신보건,은평구정신건강복지센터,서울특별시 은평구 연서로 34길 11,"정신건강 교육 및 홍보, 고위험군 발견 및 연계, 전문 상담 및 관리",02-351-8680,37.62156914,126.9276195
강원도,횡성군,정신보건,횡성군정신건강복지센터,강원도 횡성군 횡성읍 횡성로 379,"중증정신질환자관리 및 자살예방사업, 신규정신질환자 발굴 및 프로그램 운영",033-345-9901,37.4871296,127.9844504
강원도,원주시,정신보건,원주시정신건강복지센터,강원도 원주시 원일로 139,"정신질환관리, 지역주민 정신건강증진, 아동청소년 정신건강증진, 자살예방사업 등",033-746-0199,37.3515821,127.9467619
경기도,동두천시,정신보건,동두천시정신건강복지센터,경기도 동두천시 중앙로 167,"중증전신질환관리,자사예방,정신건강증진,환경조성및인식개선 업무",031-863-3632,37.89661147,127.051717
경기도,동두천시,정신보건,동두천요양원(정신요양시설),경기도 동두천시 평화로3208번길 43-15,"생활,심리,사회,교육,직업재활 업무",031-867-9820,37.97388525,127.0688704
서울특별시,성북구,정신보건,성북구정신건강복지센터,"서울특별시 성북구 화랑로 63, 6층","초발,중증정신질환자관리, 아동청소년정신건강관리,우울자살예방, 알코올중독관리 및 예방, 정신건강증진환경 조성, 코로나 관련 자가격리자 상담",02-2241-6313,37.60270967,127.0395315
서울특별시,서대문구,건강증진,건강관리센터,서울특별시 서대문구 연희로242,대사증후군관리,02-330-8727,37.5786098,126.9362749
강원도,양양군,정신보건,양양군정신건강복지센터,강원도 양양군 양양읍 양양로 9-5,"만성정신질환자관리, 정신건강증진사업, 생명존중사업",033-670-1730,38.07784528,128.6274871
인천광역시,강화군,건강증진,건강증진센터,인천광역시 강화군 강화읍 충렬사로 26-1,"체력측정실, 비만영양클리닉, 금연클리닉, 운동체험실운영",032-930-4075,37.73723039,126.4847095
제주특별자치도,서귀포시,건강증진,시민건강증진센터,제주특별자치도 서귀포시 남원읍 태위로 527,장비이용 체력단련. 체성분 측정. 건강영양상담.,064-760-6121,33.27562882,126.7034172
제주특별자치도,서귀포시,건강증진,건강증진센터,제주특별자치도 서귀포시 대정읍 최남단해안로15번길 12,장비이용 체력단련. 체성분 측정. 건강상담,064-760-6226,33.21867302,126.2532449
제주특별자치도,서귀포시,건강증진,주민건강증진센터,제주특별자치도 서귀포시 중앙로101번길 52(서홍동),장비이용 체력단련. 체성분 측정. 건강영양상담.,064-760-6094,33.2534258,126.5553625
제주특별자치도,서귀포시,정신보건,정신건강복지센터,제주특별자치도 서귀포시 중앙로101번길 52(서홍동),재활프로그램 운영 및 정신건강상담. 정신질환자 사례관리,064-760-6553,33.2534258,126.5553625
제주특별자치도,서귀포시,정신보건,중독관리통합지원센터,제주특별자치도 서귀포시 중앙로101번길 52(서홍동),중독관련 상담. 사례관리. 재활프로그램 운영,064-760-6552,33.2534258,126.5553625
경기도,안성시,건강증진,안성시보건소 건강증진센터,경기도 안성시 강변로74번길 18,"체성분측정, 혈압, 혈당, 콜레스테롤 측정, 만성질환교육, 영양교육, 비만교육, 신체활동 교육",031-678-5756,37.0001476,127.2698156
서울특별시,송파구,건강증진,송파건강증진센터,서울특별시 송파구 올림픽로 326,일반종합검진,02-2147-3539,37.514469,127.1058587
서울특별시,송파구,건강증진,송파건강관리센터,서울특별시 송파구 올림픽로 326,"1차 진료, 운동, 영양, 금연, 치매,대사증후군 관리서비스 제공",02-2147-3456,37.51447565,127.1058587
경기도,연천군,건강증진,연천군건강증진센터,경기도 연천군 전곡읍 은대성로 95,"영양상담, 운동처방",031-839-4178,38.02353445,127.0609628
경상북도,울릉군,건강증진,울릉군 통합건강증진실,경상북도 울릉군 울릉읍 울릉순환로 396-18,"통합건강증진사업(금연, 절주, 신체활동, 영양구강, 심뇌혈관질환예방관리, 아토피천식, 여성어린이특화, 재활, 방문건강관리 등), 기초건강측정(혈압, 혈당, 염도, CO)",054-790-6826,37.48590672,130.8994626
전라북도,고창군,정신보건,고창군정신건강복지센터,전라북도 고창군 고창읍 전봉준로 90,"중증정신질환자관리사업, 정신건강증진사업, 아동청소년 정신건강증진사업, 자살예방 심리치유지원사업",063-563-8751,35.4437625509,126.6832504419
대전광역시,유성구,건강증진,유성구 보건소 건강증진센터,대전광역시 유성구 유성대로 730번길 51,"개인별 맞춤형 운동처방, 대사증후군관리,비만,영양관리, 신체활동 교육, 체성분검사, 운동상담 등",042-611-5096,36.3581253,127.3354682
대전광역시,서구,건강증진,서구보건소 건강증진센터,대전광역시 서구 만년로 74,"개인별 맞춤형 운동처방, 대사증후군관리,비만,영양관리, 신체활동 교육, 체성분검사, 운동상담 등",042-288-4673,36.3670619,127.3810998
대전광역시,서구,건강증진,관저보건지소 건강증진센터,대전광역시 서구 구봉산북로 300,"개인별 맞춤형 운동처방, 대사증후군관리,비만,영양관리, 신체활동 교육, 체성분검사, 운동상담 등",042-288-4634,36.3010372,127.3450071
대전광역시,동구,건강증진,동구보건지소 건강증진지원센터,대전광역시 동구 현암로 22(삼성동),"개인별 맞춤형 운동처방, 비만, 신체활동 교육, 체성분검사, 운동상담 등",042-636-7629,36.3429869594,127.4204616889
대전광역시,대덕구,건강증진,대덕구 보건소 건강생활지원센터,대전광역시 대덕구 동춘당로 187,"개인별 맞춤형 운동처방, 대사증후군관리,비만,영양관리, 신체활동 교육, 체성분검사, 운동상담 등",042-608-4474,36.3672076725,127.4308386054
전라남도,장성군,건강증진,장성군정신건강복지센터,전라남도 장성군 장성읍 청운11길 13,"정신질환자 등록관리,자살예방사업, 아동청소년 정신보건사업",061-395-0199,35.30454285,126.7824532
전라남도,장성군,정신보건,장성군치매안심센터,전라남도 장성군 장성읍 성산5길17,"치매환자 등록 및 관리사업, 조호물품 지원, 인지재활프로그램 운영, 치매환자 가족 지원사업, 치매안심마을 운영, 치매조기검진사업, 치매치료관리비 지원, 실종예방 인식표 발급등",061-390-7160,35.3233002988,126.8083670054
경상북도,포항시,건강증진,통합건강증진센터,경상북도 포항시 북구 삼흥로 98,"대사증후군 관리 원스톱 운영, 생애주기별, 생활터별 건강증진 프로그램 운영, 모바일헬스케어 운영",054-270-4105,36.07066182,129.3804374
경상북도,포항시,건강증진,통합건강증진센터,경상북도 포항시 남구 동해안로 6119,"대사증후군 관리 원스톱 운영, 생애주기별, 생활터별 건강증진 프로그램 운영, 모바일헬스케어 운영",054-270-4081,35.99244128,129.396245
경상북도,성주군,건강증진,건강증진센터,경상북도 성주군 성밖숲길 12,건강증진상담및교육,054-930-8193,35.91741735,128.2785293
강원도,양구군,정신보건,양구군정신건강증진센터,강원도 양구군 양구읍 관공서로 42,"정신장애인 재활프로그램 운영, 자살예방",033-480-2789,38.10994446,127.9892036
전라남도,나주시,건강증진,빛가람건강생활지원센터,전라남도 나주시 빛가람로 721,건강증진,061-339-4751,35.0222053958,126.790659
전라남도,나주시,정신보건,나주시정신건강증진센터,전라남도 나주시 건재로 211,정신보건,061-330-4114,35.051091,126.7237199
경기도,용인시,건강증진,수지구보건소 건강증진센터,경기도 용인시 수지구 포은대로 435,"모바일헬스케어, 운동관리, 영양관리, 건강관리, 영양플러스사업",031-324-8838,37.3222219027,127.0974474224
경기도,용인시,정신보건,용인시정신건강복지센터,경기도 용인시 기흥구 신갈로58번길 11,"정신질환자 관리 및 정신건강증진사업,자살예방사업",031-286-0949,37.272634,127.106729
경기도,용인시,정신보건,용인시정신건강복지센터 부설자살예방센터,경기도 용인시 기흥구 신갈로58번길 11,자살예방 및 생명존중사업,031-286-0949,37.272634,127.106729
충청남도,계룡시,건강증진,통합건강증진센터,충청남도 계룡시 장안로 54,"신체활동, 영양, 비만, 만성질환 검사 및 상담",042-840-3531,36.2730058,127.250047
경기도,화성시,건강증진,웰빙건강클리닉센터(우정),경기도 화성시 우정읍 쌍봉로 109-14,생애주기별_신체활동프로그램_제공,031-369-6413,37.0898259089,126.8153597
경기도,화성시,건강증진,웰빙건강클리닉센터(우정),경기도 화성시 우정읍 쌍봉로 109-14,생애주기별_신체활동프로그램_제공,031-369-6413,37.0898259089,126.8153597
경기도,화성시,건강증진,웰빙건강클리닉센터(서신),경기도 화성시 서신면 궁평항로 1702,생애주기별_신체활동프로그램_제공,031-369-6482,37.1665869768,126.7087356267
경기도,화성시,건강증진,웰빙건강클리닉센터(서신),경기도 화성시 서신면 궁평항로 1702,생애주기별_신체활동프로그램_제공,031-369-6482,37.1665869768,126.7087356267
경기도,화성시,건강증진,U_만성질환관리센터(보건소),경기도 화성시 향남읍 3.1만세로 1055,고혈압_당뇨병_이상지질혈증_비만_비약물관리,031-369-6371,37.1292815681,126.9045557299
경기도,화성시,건강증진,U_만성질환관리센터(동탄),경기도 화성시 노작로 226-9,고혈압_당뇨병_이상지질혈증_비만_비약물관리,031-369-4374,37.2070698,127.0786006746
경기도,화성시,건강증진,U_만성질환관리센터(기배),경기도 화성시 기안남로 62,고혈압_당뇨병_이상지질혈증_비만_비약물관리,031-369-4491,37.2243352918,126.9846364182
경기도,화성시,건강증진,U_만성질환관리센터(봉담),경기도 화성시 봉담읍 동화새터길 109,고혈압_당뇨병_이상지질혈증_비만_비약물관리,031-369-6253,37.2170543838,126.9611048104
경기도,화성시,건강증진,U_만성질환관리센터(정남),경기도 화성시 정남면 서봉로 998,고혈압_당뇨병_이상지질혈증_비만_비약물관리,031-369-4481,37.160272937,126.9711096594
경기도,화성시,건강증진,U_만성질환관리센터(정남),경기도 화성시 정남면 서봉로 998,고혈압_당뇨병_이상지질혈증_비만_비약물관리,031-3699-4481,37.160272937,126.9711096594
경기도,화성시,건강증진,웰빙건강클리닉센터(우정),경기도 화성시 우정읍 쌍봉로 109-14,생애주기별_신체활동프로그램_제공,031-5189-6413,37.0898259089,126.8153597
경기도,화성시,건강증진,웰빙건강클리닉센터(우정),경기도 화성시 우정읍 쌍봉로 109-14,생애주기별_신체활동프로그램_제공,031-5189-6413,37.0898259089,126.8153597
경기도,화성시,건강증진,U_만성질환관리센터(보건소),경기도 화성시 향남읍 3.1만세로 1055,고혈압_당뇨병_이상지질혈증_비만_비약물관리,031-5189-6371,37.1292815681,126.9045557299
경기도,화성시,건강증진,U_만성질환관리센터(동탄),경기도 화성시 노작로 226-9,고혈압_당뇨병_이상지질혈증_비만_비약물관리,031-5189-4374,37.2070698,127.0786006746
경기도,화성시,건강증진,U_만성질환관리센터(기배),경기도 화성시 기안남로 62,고혈압_당뇨병_이상지질혈증_비만_비약물관리,031-5189-4491,37.2243352918,126.9846364182
경기도,화성시,건강증진,U_만성질환관리센터(봉담),경기도 화성시 봉담읍 동화새터길 109,고혈압_당뇨병_이상지질혈증_비만_비약물관리,031-5189-6253,37.2170543838,126.9611048104
경기도,화성시,건강증진,U_만성질환관리센터(정남),경기도 화성시 정남면 서봉로 998,고혈압_당뇨병_이상지질혈증_비만_비약물관리,031-5189-4481,37.160272937,126.9711096594
부산광역시,금정구,건강생활지원,장전2동건강생활지원센터,"부산광역시 금정구 금정로 29-6, 5층","금연, 절주, 신체활동, 영양, 만성질환예방 및 관리사업, 비만",051-519-5801,35.22747442,129.0855113
부산광역시,남구,건강생활지원,문현2동건강생활지원센터,부산광역시 남구 전포대로92번길 31-7,"심뇌혈관질환예방관리, 신체활동, 치매",051-607-6931,35.14527179,129.0686869
부산광역시,금정구,건강생활지원,금정구건강생활지원센터,부산광역시 금정구 서동로 175번길 41-5,"금연, 절주, 신체활동, 영양, 만성질환예방 및 관리사업, 재활",051-519-5481,35.21544759,129.1074472
부산광역시,동구,건강생활지원,행복동구건강생활지원센터,부산광역시 동구 안창로 90,"재활, 한의약건강증진, 아토피 천식 예방관리, 만성질환 예방 및 관리, 금연, 절주, 신체활동, 영양",051-440-6391,35.14449013,129.0396681
부산광역시,동래구,건강생활지원,동래구건강생활지원센터,부산광역시 동래구 명장로32,"영양, 신체활동, 심뇌혈관질환예방관리, 금연, 절주, 비만, 치매",051-550-1992,35.20469662,129.1042478
부산광역시,부산진구,건강생활지원,당감건강생활지원센터,"부산광역시 부산진구 백양순환로 40, 당감4동주민센터 4층~5층","심뇌혈관, 신체활동, 비만, 영양, 구강, 금연, 절주, 치매",051-605-6113,35.16822222,129.0334223
부산광역시,부산진구,건강생활지원,개금2동건강생활지원센터,"부산광역시 부산진구 복지로 93, 개금2동주민센터 2층","심뇌혈관, 신체활동, 비만, 치매",051-605-6693,35.14490697,129.0195347
부산광역시,사하구,건강생활지원,다대건강생활지원센터,부산광역시 사하구 다대로 530번길 7,"만성질환 예방 및 관리사업, 신체활동, 영양, 금연절주, 정신건강관리",051-220-5727,35.05916984,128.9713294
부산광역시,중구,건강생활지원,중구건강생활지원센터,부산광역시 중구 흑교로 48(보수동1가),"영양, 금연, 절주, 심뇌혈관질환예방관리, 운동, 재활",051-600-4726,35.10377395,129.0253563
부산광역시,남구,건강생활지원,문현1동건강생활지원센터,부산광역시 남구 고동골로60번길 1,"심뇌혈관질환예방관리, 신체활동, 치매",051-607-6912,35.14253417,129.0713224
경기도,남양주시,건강생활지원,화도건강생활지원센터,경기도 남양주시 화도읍 비룡로 59,"신체활동, 비만, 영양, 만성질환예방관리",031-590-8433,37.65784853,127.3007112
부산광역시,남구,건강생활지원,용호3동건강생활지원센터,부산광역시 남구 동명로164번길 40,"심뇌혈관질환예방관리, 신체활동, 치매",051-607-6771,35.11733521,129.1141211
부산광역시,사하구,건강생활지원,장림1동건강생활지원센터,부산광역시 사하구 장림로161번길2 보림행복센터,"금연, 치매, 신체활동, 심뇌혈관질환예방관리",051-262-9485,35.08305432,128.9668712
부산광역시,부산진구,건강생활지원,개금3동건강생활지원센터,부산광역시 부산진구 개금본동로 88,"심뇌혈관, 신체활동, 비만, 치매",051-605-6548,35.15576358,129.0219366
대구광역시,북구,건강생활지원,구암건강생활지원센터,대구광역시 북구 구암서로 30,"건강동아리, 신체활동, 금연, 치매, 방문건강관리",053-665-4281,35.9386464,128.5660100361
대구광역시,서구,건강생활지원,서구건강생활지원센터(대구광역시),대구광역시 서구 서대구로7길 46,"신체활동, 심뇌혈관질환예방관리",053-663-3231,35.86074781,128.551416
대구광역시,수성구,건강생활지원,고산건강생활지원센터,대구광역시 수성구 욱수천로 99,"모바일헬스케어, 심뇌혈관질환예방관리, 신체활동, 구강, 금연, 방문, 모자보건, 치매",053-666-3160,35.8369885,128.7128212
인천광역시,계양구,건강생활지원,효성건강생활지원센터,"인천광역시 계양구 봉오대로 543번길 21, 효성평생건강센터 3층","금연, 신체활동, 심뇌혈관질환예방관리",032-430-7793,37.53252721,126.7086103
인천광역시,남동구,건강생활지원,간석건강생활지원센터,인천광역시 남동구 간석로 41번길 18,"만성질환예방관리, 장애인재활사업, 치매주간보호센터사업, 이동건강관리사업, 건강생활실천사업",032-453-5960,37.46745879,126.7130108
인천광역시,부평구,건강생활지원,열우물건강생활지원센터,인천광역시 부평구 열우물로 103,"금연, 신체활동, 심뇌혈관질환예방관리",032-459-3164,37.47580459,126.6961223
인천광역시,서구,건강생활지원,가좌건강생활지원센터,인천광역시 서구 건지로 284번길 60,"건강원스톱사업, 심뇌혈관예방사업, 건강증진프로그램, 금연 및 흡연예방, 임산부등록 및 관리, 구강, 혈관노화도, 혈압ㆍ혈당ㆍ재활기구 대여사업",032-718-0570,37.49392982,126.6730351
인천광역시,서구,건강생활지원,검단건강생활지원센터,인천광역시 서구 완정로 214,"금연, 임산부, 신체활동, 심뇌혈관질환예방관리",032-718-0580,37.60359312,126.6529572
인천광역시,서구,건강생활지원,석남건강생활지원센터,"인천광역시 서구 길주로 79, 6층","건강생활실천사업, 심뇌혈관질환예방관리, 금연, 임산부등록, 재활기구대여, 불소양치용액배부 및 틀니세척",032-718-0550,37.50676483,126.670879
인천광역시,서구,건강생활지원,완정건강생활지원센터,"인천광역시 서구 청마로 167번길 19, 2층","건강생활실천, 심뇌혈관질환예방, 신체활동, 금연, 구강, 모자, 재활",032-718-0530,37.59210015,126.6746299
인천광역시,연수구,건강생활지원,송도건강생활지원센터,인천광역시 연수구 인천타워대로54번길 19,"만성질환관리, 건강생활실천관리, 장애인재활관리, 모자보건관리",032-749-6915,37.37978091,126.6465727
광주광역시,광산구,건강생활지원,수완건강생활지원센터,광주광역시 광산구 장덕로 158,"건강생활실천사업, 신체활동, 아토피, 심뇌혈관질환예방관리, 모자보건사업, 재활사업 등",062-960-8822,35.19707398,126.8257309
광주광역시,광산구,건강생활지원,우산건강생활지원센터,광주광역시 광산구 사암로 167,"구강, 건강생활실천, 모바일 헬스케어, 대사증후군, 재활",062-960-3801,35.15931267,126.8075588
경기도,남양주시,건강생활지원,호평건강생활지원센터,경기도 남양주시 호평로68번길 21,"신체활동, 비만, 만성질환예방관리, 스트레스관리",031-590-8088,37.65456793,127.2489488
광주광역시,남구,건강생활지원,월산건강생활지원센터,광주광역시 남구 중앙로 12,"만성질환예방관리, 건강생활실천, 치매예방관리, 영양교육, 운동처방실, 건강동아리활동지원지역사회 연계협력",062-607-6151,35.14458489,126.8999216
광주광역시,남구,건강생활지원,주월건강생활지원센터,광주광역시 남구 군분로 13번길 10,"신체활동, 영양교육, 건강의날, 운동처방실, 건강동아리활동지원, 만성질환예방관리, 지역사회 연계협력, 심뇌혈관질환 예방관리",062-607-3133,35.13480924,126.8944811
광주광역시,동구,건강생활지원,지원건강생활지원센터,"광주광역시 동구 지원로 31-9, 2층(소태동)","만성질환예방 및 관리사업, 신체활동, 영양, 비만, 재활",062-608-3950,35.1253006,126.9351767
광주광역시,북구,건강생활지원,두암건강생활지원센터,광주광역시 북구 군왕로 141번길 6,"방문건강관리, 재활보건",062-410-8984,35.17431405,126.9324676
